event,sport,commence_time,implied_prob_sum,arbitrage,profit,roi,best_outcome,best_bookmaker,best_american_odds,best_decimal_odds
New York Knicks vs Atlanta Hawks,NBA,2026-04-06T23:10:00Z,1.0172,False,,,New York Knicks,LowVig.ag,112,2.12
Detroit Pistons vs Orlando Magic,NBA,2026-04-06T23:10:00Z,1.0237,False,,,Orlando Magic,FanDuel,136,2.36
Cleveland Cavaliers vs Memphis Grizzlies,NBA,2026-04-07T00:10:00Z,1.0,True,0.0,0.0,Memphis Grizzlies,LowVig.ag,910,10.1
Philadelphia 76ers vs San Antonio Spurs,NBA,2026-04-07T00:10:00Z,1.0246,False,,,Philadelphia 76ers,LowVig.ag,293,3.93
Portland Trail Blazers vs Denver Nuggets,NBA,2026-04-07T01:10:00Z,1.0194,False,,,Portland Trail Blazers,Bovada,290,3.9
